{
  "schema_version": 1,
  "puzzle_id": "strings-basics.002",
  "puzzle_version": 1,
  "toolchain": "1.97.1",
  "outcomes": {
    "11404ad8f6b80bba68bc97c8cf1f551274ea069a1ccf00d3f6addb7f530f89d3": {
      "status": "solved",
      "rank": "optimal",
      "metrics": {
        "token_edits": 2
      },
      "diagnostics": []
    },
    "3a72b5c8d49af118b8d82de1350e4670058d991df7d06809fb5dbb8ec760b3be": {
      "status": "compile_error",
      "rank": null,
      "metrics": {},
      "diagnostics": [
        {
          "category": "type_mismatch",
          "message": "mismatched types",
          "slot_ids": [],
          "rust_code": "E0308"
        },
        {
          "category": "compile_error",
          "message": "aborting due to 1 previous error",
          "slot_ids": [],
          "rust_code": null
        }
      ]
    },
    "5414313faa1487f089fdb23f0b47545e62c448b2b93436c7af1b65576b707d48": {
      "status": "compile_error",
      "rank": null,
      "metrics": {},
      "diagnostics": [
        {
          "category": "type_mismatch",
          "message": "mismatched types",
          "slot_ids": [
            "arg"
          ],
          "rust_code": "E0308"
        },
        {
          "category": "type_mismatch",
          "message": "mismatched types",
          "slot_ids": [],
          "rust_code": "E0308"
        },
        {
          "category": "compile_error",
          "message": "aborting due to 2 previous errors",
          "slot_ids": [],
          "rust_code": null
        }
      ]
    },
    "604fbcac3cb09b10009f7c23f45b2ddba35e1b44daa896b16ee7477d94afa32a": {
      "status": "compile_error",
      "rank": null,
      "metrics": {},
      "diagnostics": [
        {
          "category": "type_mismatch",
          "message": "mismatched types",
          "slot_ids": [
            "body"
          ],
          "rust_code": "E0308"
        },
        {
          "category": "compile_error",
          "message": "aborting due to 1 previous error",
          "slot_ids": [],
          "rust_code": null
        }
      ]
    },
    "700d923ccd1cc86e534c26e223e15e155585af115e179d91b9dcb2e3be6b6ad2": {
      "status": "compile_error",
      "rank": null,
      "metrics": {},
      "diagnostics": [
        {
          "category": "type_mismatch",
          "message": "mismatched types",
          "slot_ids": [
            "body"
          ],
          "rust_code": "E0308"
        },
        {
          "category": "compile_error",
          "message": "aborting due to 1 previous error",
          "slot_ids": [],
          "rust_code": null
        }
      ]
    },
    "87b3aa90f4304b470979c25e9d91a27899a0485894a9d6d0e653d78576762c12": {
      "status": "compile_error",
      "rank": null,
      "metrics": {},
      "diagnostics": [
        {
          "category": "type_mismatch",
          "message": "mismatched types",
          "slot_ids": [],
          "rust_code": "E0308"
        },
        {
          "category": "compile_error",
          "message": "aborting due to 1 previous error",
          "slot_ids": [],
          "rust_code": null
        }
      ]
    },
    "9c56308986fe0e6fbf61eac4a5f4bc8d6228c5439e5ee494f739a0dec917ef75": {
      "status": "compile_error",
      "rank": null,
      "metrics": {},
      "diagnostics": [
        {
          "category": "type_mismatch",
          "message": "mismatched types",
          "slot_ids": [
            "arg"
          ],
          "rust_code": "E0308"
        },
        {
          "category": "compile_error",
          "message": "aborting due to 1 previous error",
          "slot_ids": [],
          "rust_code": null
        }
      ]
    },
    "b28dfb64b75fb6ae783d98a40798a5d2b4bd606c7f26b5c122be622a61feb2d7": {
      "status": "solved",
      "rank": "optimal",
      "metrics": {
        "token_edits": 2
      },
      "diagnostics": []
    },
    "d4002eea6f44e282338d025cadea9a14a4292187192cdec6d856a11d3afe36f3": {
      "status": "compile_error",
      "rank": null,
      "metrics": {},
      "diagnostics": [
        {
          "category": "type_mismatch",
          "message": "mismatched types",
          "slot_ids": [
            "arg"
          ],
          "rust_code": "E0308"
        },
        {
          "category": "type_mismatch",
          "message": "mismatched types",
          "slot_ids": [
            "body"
          ],
          "rust_code": "E0308"
        },
        {
          "category": "compile_error",
          "message": "aborting due to 2 previous errors",
          "slot_ids": [],
          "rust_code": null
        }
      ]
    }
  }
}
